5113	6aTL9T7YKTI	00:10:26	Оля	А на сьогодні це все. З вами була Оля ПроВойс. Побачимось. 
5135	CJYkzFKoIME	00:00:00	Оля	Всім привіт! Ви наканалі Оля ПроВойс, і в цьому відео я хочу розібрати вокал нової чудової пісні "Чому" Альони Альони та Джері Хейл. Це вже не перша спільна пісня цих виконавиць. І, як на мене, їхній тандем надзвичайно крутий. Мені імпонує їхня творчість і також їхні спільні роботи.
5138	CJYkzFKoIME	00:00:22	Оля	Взагалі, Альона Альона та Джері Хейл пишуть пісні не лише собі, але і іншим виконавцям. Наприклад, Джері Гейл, Яна, пише пісні Дантесу та Вєрі Брєжнєвій і іншим виконавцям. А Альона Альона є автором тексту відомої пісні "Вільна", яку виконує Тіна Кароль та Юлія Саніна.
5141	CJYkzFKoIME	00:00:44	Оля	Тому кожна їхня дуетна пісня - це просто така вибухова суміш таланту, е, стилю, естетики. Особисто мені ця їх нова пісня сподобалася с перших секунд. Одразу захотілося зробити на неї розбір вокалу. Яна пише надзвичайно мелодійні приспіви, які запам'ятовуються прямо з першого разу, і ти ще довго ходиш їх наспівуєш.
5144	CJYkzFKoIME	00:01:10	Оля	А тепер давайте перейдемо до самої пісні і розберемо детально, яку саме вокальну техніку використовують ці дві артистки, а, чим ця пісня нам так подобається. Слухаємо пісню.
5148	CJYkzFKoIME	00:01:25	Яна	Кому Бог відкриє карман, повний істини? Тому, хто черпає долонями чистими
5152	CJYkzFKoIME	00:01:42	Оля	Пісня починається з приспіву, у виконанні Яни. Звучить цей приспів дуже ніжно, дуже тендітно, а, дуже мелодійно. А, з вокальної, технічної точки зору вона використовує тут такий прийом як фальцет - це звук з повітрям, який ми чуємо, наче такий, на придиханні, на зітханні.
5155	CJYkzFKoIME	00:02:05	Оля	Цей звук сприймається нами, як от надзвичайно ніжний голос. Саме цей прийом використала Яна, щоб передати зміст тих рядків, того болю, який закладений, взагалі, в цьому тексту, в цій пісні. Вона написана під час війни, яка і досі триває, на жаль, у нас. А, тому тут дуже глибокий зміст, який чіпляє кожного. Ми відчуваємо кожною клітинкою нашого тіла, а, …
5158	CJYkzFKoIME	00:02:34	Оля	… той сум, про який співають Яна та Альона.
5162	CJYkzFKoIME	00:02:38	Яна	Чому ж ми йдемо на невивчені відстані, Черпаєм з болота і в ньому шукаємо пристані.
5166	CJYkzFKoIME	00:02:54	Оля	Значить, мелодія тут, в принципі, проста, і вона така, да, повторюється, особливо перші три рядки. "Кому Бог відкриє карман, повний істини". Нагору йде. "Тому хто черпає долонями чистими. 
5169	CJYkzFKoIME	00:03:19	Оля	Чому ж ми йдемо на невивчені відстані?". Тут цікаво мелодія піднімається нагору. "Чому ж ми йдемо, ми йдемо?" Е, підкреслює слово "ми йдемо", так, змінюючи мелодію трішки нагору.
5172	CJYkzFKoIME	00:03:40	Оля	І четвертий рядок, взагалі, інша мелодія, інша ритміка: "Черпаєм з болота і в ньому шукаємо пристані". Дуже ніжно і стримано звучить цей перший приспів. Е, ще у цьому приспіві Яна використовує такий прийом як cry. Вона трохи додає в свій голос плач, акуратно так, тобто співає з повітрям і ще й наче приплакує:… 
5175	CJYkzFKoIME	00:04:09	Оля	"Кому Бог відкриє карман, повний істини". І де-не-де вона також додає таке легке, акуратне вібрато. Вібрато  - це коли наш голос починає рівномірно дрижати: "А-а-а-а-а-а-а". "Кому", да, на цих довгих нотках.
5178	CJYkzFKoIME	00:04:33	Оля	Тобто цей приспів звучить стримано, сумно, з болем. Далі йде куплет, і куплет - це реп Альони Альони. Давайте послухаємо:…
5182	CJYkzFKoIME	00:04:46	Альона	А в небі знов літають чорні ворони, І ми розбіглись всі у різні сторони, ей, Деталі із одного механізму, Хтось рано, а хтось пізно, Щоб свої землі боронить
5186	CJYkzFKoIME	00:04:54	Оля	Цей куплет дуже сильно чіпляє своїм змістом, своєю глибною. Альона Альона це дуже добре вміє робити, и, використовуючи реп. 
5190	CJYkzFKoIME	00:05:04	Альона	Розкидані із цілого уламками, де, Здавалося, що є давно у дамках ми, бо вміємо терпіти і прощати, але пам'ята Хрещатикполум'я за барикадами, хе, хе-хей. Куди дівати свою віру в правду? Це ніби якийсь пранк, але пали стіни храму. I те, що ми чули зранку за своїми фіранками, змусило нас переоцінити свої рамки тут, бо в серці завжди є місце для любові. I хай iз неба ллє ця цілюща повінь, бо спершу за своє, а за iнше – потім, До істини вези нас, потяг.
5194	CJYkzFKoIME	00:05:29	Оля	Куплет достатньо довгий, так, багато тексту. Взагалі, реп - це трохи щось таке окреме від звичайного співу. Я не експерт саме в репі. Але, що я можу про нього сказати: реп - це такий, ритмічний речитатив, так? Тут основний акцент робиться саме на ритмі, тобто людина, яка читає реп, повинна дуже тонко, чітко й круто відчувати саме ритм, а,…
5197	CJYkzFKoIME	00:05:56	Оля	… тому що вона голосом має передати ці всі акценти, а, робити певні паузи. А, тому що тут голос виступає, наче додатковий інструментер в ритм секції. Ритм-секція - це барабани, бас-гітара. Тобто це ті інструменти, який з... заставляють слухача качатися, коли він слухає цю пісню, танцювати. Ось. А, тому читати реп, ну, може далеко не кожен. 
5200	CJYkzFKoIME	00:06:23	Оля	А, якщо людина, вона зв'язана з музикою, вона співає, скоріше за все вона зможе прочитати, звісно, цей реп, просто їй треба до цього підготуватися. А також в репі відіграє велику роль, и, саме дикція, вимова. Що ще хочу сказати? 
5203	CJYkzFKoIME	00:06:38	Оля	Що реп - це не просто якась така монотонна начитка, так, там є своя мелодія, своя динаміка, своє фразування. Це теж все дуже й дуже надзвичайно музично. Ну, якщо взяти партію Альони Альони, я не буду весь куплет зараз зачитувати. 
5206	CJYkzFKoIME	00:06:55	Оля	Ось, вона теж робить певні акценти в певних фразах, так, в кожній фразі, власне, є свої акценти: "А в небі знов літають чорні ворони, І ми розбіглись всі у різні сторони..." "Ворони, сторони" тут акцентується. "Деталі із одного механізму, деталі із одного, одного".  Слово "одного" вона качає, так, трошки нагору? "Деталі із одного механізму, 
5209	CJYkzFKoIME	00:07:16	Оля	Хтось рано, а хтось пізно, Щоб свої землі боронить". Тут так само: "Хтось рано, а хтось пізно", бачте, є такий, зміна навіть висоти голосу. Так, якісь слова розтягується, якісь слова більш коротко і точно. Десь вона робить акценти. Ну, якщо вслухатися і дивитися одночасно в текст, одразу стає більш зрозуміло. 
5212	CJYkzFKoIME	00:07:37	Оля	Ще цікаво, е, в цьому куплеті з репом Альони бек-вокал Яни. Вона робить такі маленькі акценти голосом, дуже ніжним, підкреслюючи кінцівки деяких рядочків Альони Альони. "Хрещатик, Прощати, Правду, Та". Якшо вслухатися, там є її голос. М, ще, що прикольно, це те, що, от був спочатку у нас приспів суперніжний, тендітний. Тут вступає Альона,…
5215	CJYkzFKoIME	00:08:05	Оля	… і, е, теж на контрасті все відбувається, у Альони, а, оскільки це реп, подача більш об'ємна, більш емоційна, більше динамічна, тому що, зазвичай, він читається, ну, як би, повним голосом. 
5218	CJYkzFKoIME	00:08:17	Оля	Реп - це людина просто наче говорить, так, ритмічно, і протягує деякі, м, деякі голосні. Ще з приводу бек-вокалу, е, перед тим, як вступає Альона, е, Яна ще доспівує: "У-у-у-у-у-у, у-у-у-у-у-у, у-у-у-у-у-у-у-у". 
5221	CJYkzFKoIME	00:08:40	Оля	Ось така бек-вокальна партія також тут присутня. Давайте почуємо, що буде далі.
5225	CJYkzFKoIME	00:08:45	Яна	Кому Бог відкриє карман, повний істини? Тому, хто черпає долонями чистими-и-и-и. 
5229	CJYkzFKoIME	00:09:02	Оля	Ми можемо почути, що трохи вона вже тут робить розвиток в динамічному плані, співає, м, не настільки, е, повітряно і ніжно, як це було на початку пісні. А, дає трошки більше динаміки, співає місцями трохи голосніше, і також місцями, я зараз покажу, де, вона додає твенг, тобто робить голос більш дзвінким, пронизливим і зібраними: "Кому". 
5232	CJYkzFKoIME	00:09:30	Оля	Навіть перше "Ко": "Кому Бог відкриє карман, повний істини, істини". Оце слово "Істини" вона підкреслює тут, так, більш дзвінко співає. "Тому хто черпає долонями чистими-и-и". 
5235	CJYkzFKoIME	00:09:51	Оля	Отут: "ми-и" розкриває саме це слово. 
5239	CJYkzFKoIME	00:09:56	Яна	Чому ж ми йдемо на невивчені відстані. Черпаєм з болота і в ньому шукаємо пристані. 
5243	CJYkzFKoIME	00:10:12	Оля	Отут так само в кінці додає більше дзвінкості. "Чому ж ми йдемо на невивчені відстані?". Тут ніжно, фальцетно, звучить її голос. "Черпаєм з болота і в ньому шукаємо пристані". Теж трохи додає дзвінких частот, ну, тобто динамічно виростає, і це логічно, тому що пісня повинна розвиватися,… 
5246	CJYkzFKoIME	00:10:41	Оля	… нам має бути цікаво слухати її далі. Значить, прозвучав другий приспів і, що далі, слухаємо
5250	CJYkzFKoIME	00:10:49	Альона	Так хочеться навколо шматувати все! Так хочеться для споминів тримати сейф! Так хочеться для всіх здаватись кращими, так казали пращури – і слова ці мали сенс, мали. Чому ж навколо стільки всього злого, чому? І душу тепер ранить смерть, і вже не ранить слово, чуєш? Вирвіть мені серце, люди, адже я не робот, ні! Скільки ще пролитись має крові, скільки треба...
5254	CJYkzFKoIME	00:11:06	Оля	Бачите, я навіть сижу, слухаю, качаюсь. Тому що, ну, дійсно реп, він качає, ще більше, ніж просто будь-яка інша пісня
5258	CJYkzFKoIME	00:11:13	Альона	Плакати, злитися, бути спустошеним. Кажуть, "нормально", i так робить кожен. Та як по крупиці зібратися в ціле, коли все навколо лиш чорне та бiле, біле?! Пофiксити зламане, зцілити душу. Ми як нові, тільки з міткою "бувшого". Час все розставить на свої місця там. Де в серці відкриті дверцята
5262	CJYkzFKoIME	00:11:30	Оля	Значить, другий куплет, знову реп від Альони Альони. Ще більш емоційний, ніж був в першому куплеті. А, вона теж багато робить акцентів у кожній фразі. Вона тут дуже цікаво виділяє кінцівки: "Так хочеться навколо шматувати все, так хочеться для споминів тримати сейф, Так хочеться для всіх здаватись кращими, Так казали пращури, і слова ці мали сенс".
5265	CJYkzFKoIME	00:11:53	Оля	Ось, і, а..., ну, грається ритмікою, грається, а, и, акцентами, динамікою, висотою нот. Оце все в репі присутнє. І знову тут на фоні бек-вокал Яни: "у-у-у-у-у-у". Ці ж самі "у". Також в певних місцях Яна додає фальцетні такі, и, вставочки і підкреслення на певних словах: "всього злого, ранить слово, не робот".
5268	CJYkzFKoIME	00:12:20	Оля	Тобто таким, дуже ніжним, зі повітрям. І давайте послухаємо далі: 
5272	CJYkzFKoIME	00:12:24	Яна	Кому Бог відкриє карман, повний істини. Тому, хто черпає долонями чистими-и. 
5276	CJYkzFKoIME	00:12:42	Оля	Ось такий, третій вже, виходить, приспів, після другого куплету. А, він тут звучить, в принципі, однаково, як і звучав після першого, як на мене. Е, ну, я маю на увазі і мелодію, і динаміку, і емоційну складову
5280	CJYkzFKoIME	00:12:56	Яна	Чому ж ми йдемо на невивчені відстані, Черпаєм з болота і в ньому шукаємо пристані
5284	CJYkzFKoIME	00:13:12	Оля	О, давайте послухаємо тоді, що буде вже після нього
5288	CJYkzFKoIME	00:13:17	Яна	У-у-у-у-у-у, у-у-у-у-у-у
5292	CJYkzFKoIME	00:13:20	Оля	Знову йде бек-вокал на "у". 
5296	CJYkzFKoIME	00:13:26	Яна	У-у-у-у-у-у-у-у, у-у-у-у-у-у, у-у-у-у-у-у, у-у-у-у-у-у-у
5300	CJYkzFKoIME	00:13:33	Оля	І тут ми чуємо, що додався ще один голос трошки вище, тобто мелодія розійшлась на два голоси. Було: "У-у-у-у-у-у, ху-у-у-у-у-у, у-у-у-у-у-у-у-у". І додався ще один голос на терцію вверх від основної мелодії, яка звучала до цього. І звучить він так: "Ху-у-у-у-у-у, ху-у-у-у-у-у, ху-у-у-у-у-у-у-у". 
5303	CJYkzFKoIME	00:14:03	Оля	І разом вони, звісно, звучать дуже й дуже гарно.
5304	CJYkzFKoIME	00:14:03	Оля	Ось така чудова пісня Альони Альони та Джері Хейл.
5305	CJYkzFKoIME	00:14:03	Оля	Напишіть, до речі, як вам саме ця їхня спільна пісня і яка пісня, можливо, ваша улюблена.
5308	CJYkzFKoIME	00:14:17	Оля	Ще цікаво, напишіть, чи був у вас досвід читати реп, чи хотіли би Ви навчитися. Цікаво, як ви взагалі ставитеся саме до репу.
5309	CJYkzFKoIME	00:14:17	Оля	І на цьому моє відео підійшло до завершення.
5310	CJYkzFKoIME	00:14:17	Оля	Якщо тобі сподобалось це відео, став свій лайк, підписуйся на мій канал. І я буду знімати нові відео і розбирати вокали до нових чудових українських пісень.
5311	CJYkzFKoIME	00:14:17	Оля	З вами була Оля ПроВойс. До наступних зустрічей.  
5330	jUDKP7CQafE	00:00:00	Спікер	Як співати і потрапляти в ноти? Фа-фа-фа.
5331	jUDKP7CQafE	00:00:00	Спікер	"До-до-до", забагато "до".
5332	jUDKP7CQafE	00:00:00	Спікер	У мене немає ні голосу, ні слуху, що мені робити?
5333	jUDKP7CQafE	00:00:00	Спікер	Я видумую-у-у, видумую. Повірте, ви це відчуєте.
5334	jUDKP7CQafE	00:00:00	Спікер	Друзі, привіт, ви на моєму каналі, з вами Оля ПроВойс, і сьогодні буде нове корисне відео для вас на дуже цікаву тему:
5336	jUDKP7CQafE	00:00:25	Спікер	 "Як співати і потрапляти в ноти?". Це питання, яке цікавить дуже багатьох людей, особливо, тих хто тільки починає свій вокальний шлях.
5337	jUDKP7CQafE	00:00:25	Спікер	Дуже часто ми чуємо таку фразу: "В мене немає ні голосу, ні слуху. Що мені робити?"
5338	jUDKP7CQafE	00:00:25	Спікер	Тепер давайте розберемося.  
5339	jUDKP7CQafE	00:00:25	Спікер	Дивіться, якщо людина, в принципі, вміє говорити, в неї немає якихось патологій голосу, вона не говорить ось так: "Добрий день, добрий день", це вже значить, що в неї є голос.
5341	jUDKP7CQafE	00:00:55	Спікер	Інша справа чи вміє вона ним користуватися саме під час співу. Тобто тут треба працювати, звісно, над технікою вокалу, розкривати ваш голос. Тому що у його можливості надзвичайно величезні. А щодо фрази "у мене немає слуху". Теж, якшо ви, в принципі, людина, яка чує, ви не глуха, у вас немає вроджених особливостей, то все, що вам треба розвинути, це саме ваш...
5343	jUDKP7CQafE	00:01:21	Спікер	... музичний слух. Адже, коли ми ще дуже маленькі, і вчимося говорити. Як ми запам'ятовуємо звуки і слова дорослих. Саме музичний слух нам допомагає запам'ятати ці інтонації, цю різницю між звуками. І, врешті-решт, практично кожна людина, вона говорить. То чому одні люди потрапляють в ноти, а інші не потрапляють? Тут потрібно розвивати...
5345	jUDKP7CQafE	00:01:48	Спікер	... саме координацію між вашим слухом та вашим голосом. Тому що, а у деяких людей від самого народження ця координація добре налаштована, ну, це якось генетично передається. А інші люди, їм важче, а, знайти ту нотку так швидко, так влучно. Але повірте, усе можна розвинути.
5347	jUDKP7CQafE	00:02:10	Спікер	Давайте собі уявимо, як це все працює і що таке ця координація? До прикладу, є якийсь звук, так? Наш слуховий нерв спіймав цей звук, дає сигнал в мозок, що звучить така-то, така-то нота. Мозок, в свою чергу, дуже швидко передає сигнал нашим іншим голосовим зв'язкам та іншим м'язам і структурам, які беруть...
5349	jUDKP7CQafE	00:02:34	Спікер	... участь у звукоутворенні. І тільки після цього відбувається: "м-а, м-а" відбувається вже нота. Так? Уявіть, який довгий, великий шлях нам треба подолати, щоби, зрештою, наш голос потрапив у певну ноту. І звісно, якщо ви, в принципі, в житті співали не так і багато, ніколи не тренували ваш...
5351	jUDKP7CQafE	00:02:57	Спікер	...слух, то ця координація, вона буде, така, дуже повільна. А, і саме тому люди приходять на уроки вокалу до педагога, який за допомогою різних і корисних вправ розвиває ваш слух, так, а, тому що ми маємо спочатку почути нуту, потім її відтворити. Тут ще важливу роль...
5353	jUDKP7CQafE	00:03:20	Спікер	... відіграє саме наша музична пам'ять. Тобто одна справа, коли ми нотку почули, а нам треба ще ж її запам'ятати. А, щоби потім проспівати, наприклад, уже без інструменту. Або, коли ви хочете заспівати якусь пісню, вам треба її почути, запам'ятати мелодію, щоби потім змогти відтворити уже, використовуючи тільки свій власний голос, тобто під мінус, так, коли у нас немає ніякого жодного...
