3959	9NfgRd-fxw4	00:01:52	Оля	Звісно, Adele, всі пісні, вона теж дуже-дуже багато твенгує. А, як там? "And they fire starting in my heart...". Ну, я надіюсь, мої приклади вам допомогли зрозуміти, да, що ми сьогодні взагалі розбираємо, що це таке? А, і отаке звучання для нас, українців, не дуже притаманне, чому? Тому що наша мова фонетично будується інакше.
3961	9NfgRd-fxw4	00:02:21	Оля	А, коли ми спілкуємося українською мовою чи російською, у нас звуки більш прикриті, більш, такі, гортанні. Не такі яскраві, тобто, ми, наприклад, кажемо: "А, так, в мене все добре, так, в мене все добре". А, до прикладу, американці говорять: "E, I'm a right, e I'm fine". Да, відчуваєте, знову ж таки, як змінюється звучання мого тембру? Тобто. Що я маю на увазі? А, носії англійської мови, а особливо,...
3963	9NfgRd-fxw4	00:02:48	Оля	... американська вимова, якщо взяти. А, вони говорять дуже й дуже дзвінко, уже з самого народження. Вони прямо, знаєте, з молоком матері їм передається, а, саме така вимова. Тому, e, коли вони співають, їх голос звучить от прям інакше. Насправді, у них такі ж самі вокальні структури, хрящі, голосові зв'язки, нічого там такого немає, все однакове, таке ж, як і у нас.
3964	9NfgRd-fxw4	00:02:48	Оля	Але через те, що вони звикли, и, будувати звуки всередині трохи інакше, ...
3966	9NfgRd-fxw4	00:03:18	Оля	...вони в піснях теж звучать, як ми чуємо, дещо, ну..., відрізняється, так, від нашого співу.
3967	9NfgRd-fxw4	00:03:18	Оля	І як же нам віднайти цей звук у собі? Дуже просто. Банально через кривляння. Нам потрібно співати, експериментувати, а, вживатися в певний образ, трошечки свій голос спеціально видозмінювати,...
3969	9NfgRd-fxw4	00:03:40	Оля	... не боятися співати не своїм голосом, наче якимось чужим голосом. Це теж, е, ваш звук, просто ви не звикли його формувати саме так. А, і це звісно, якщо ви бажаєте, от, звучати так фірмово, по західному, да, то треба не боятися саме оцих експериментів. На своїх заняттях з вокалу ми з учнями робимо прямо, знаєте, на кожному уроці оці вправи. Ми дуркуємо. Це і весело, і корисно.
3971	9NfgRd-fxw4	00:04:07	Оля	 І сьогодні також вам я продемонструю такі дуже-дуже прості, але дієві вправи. Я надіюся, що ви зараз будете повторювати за мною, і у вас все обов'язково вийде. Ну що, поїхали. Будемо шукати оцей звук через різноманітні емоції, образи, асоціації.
3972	9NfgRd-fxw4	00:04:07	Оля	Е, перше. Уявили качечку на ставочку. І робимо такий звук: "А, а, а".
3974	9NfgRd-fxw4	00:04:34	Оля	Бачте, як різко я звучу? Різко, противно. Так і має бути. Чому? Тому що зараз ми шукаємо, знаєте, так, гіперболізуючи оцей звук. Для чого? Для того, щоби, а, м'язово навіть запам'ятати, як ми це зробили. Да? Тому що, якшо тіки трошечки, там: "а-а", дуже складно зрозуміти, як воно працює.
3975	9NfgRd-fxw4	00:04:34	Оля	Тому не бійтеся, що ваш голос буде прямо звучати якось, ну, дуже різко і противно. Значить, качечка: "е-е-е". 
3977	9NfgRd-fxw4	00:05:01	Оля	Робимо: "е-е-е". Да, отакий, прям, відчуваєте, ну от, різкий, різкий звук. И, дуже починає отут на обличчі все резонувати. Навіть може трошки як вуха закладати. Це теж абсолютно нормально. А, для когось, можливо, качечка складно. Тому в мене є ще інші варіанти, які нам допоможуть.
3978	9NfgRd-fxw4	00:05:01	Оля	Тепер можна уявити собі капризну дитину, яка не хоче їсти кашу і говорить так: "Нє-нє-нє, нє-нє-нє", ...
3980	9NfgRd-fxw4	00:05:28	Оля	...прям насупитися - "нє-нє-нє". А потім вона передумала, і їсть кашу із задоволення і каже: "ням-ням-ням-ням-ням, мням-мням-мням-мням-мням". Пробуйте.
3981	9NfgRd-fxw4	00:05:28	Оля	Гаразд. Ще, яка асоціація. Можна уявити, що, знову ж таки, ми діти, але вже трошки більш дорослі, і, а, давайте спробуємо подражнити одне одного, н-е, отакими словами: ...
3983	9NfgRd-fxw4	00:05:55	Оля	"Ай-яй-яй-яй-яй, ай-яй-яй-яй-яй, нє-нє-нє-нє-ня". Ну, відчуваєте, як мій звук міняється. Ще я обожнюю таку асоціацію. Серіал "Друзі", якщо ви дивилися, а, значить, Дженіс, яка, и, завжди говорить одну і ту ж фразу дуже противним голосом: "Еу, май гад". І ми прямо з учнями повторюємо цю манеру, да, намагаємося зімітувати цей голос: "Еу май гад". 
3985	9NfgRd-fxw4	00:06:25	Оля	Тобто ми кажем: "О, Боже, о, Боже". А вони кажуть: "О май гад". Спробуйте: "А май гад". Ви можете відчути, от, якшо, да, коли ми промовляємо саме таким голосом якесь певне звуження всередині. Але наші голосові зв'язки при цьому, вони не задіяні, ну, тобто, ми не відчуваємо, да, якийсь зажим в області горла, але відчуваємо якесь звуження. Воно, правильно, що воно є. Але воно вище голосових зв'язок...
3987	9NfgRd-fxw4	00:06:53	Оля	... формується, наче там, де закінчується підборіддя: "е-е, о, май гад". І це дуже правильні відчуття. Якшо вам вдасться їх зараз зафіксувати в собі, да, м, і запам'ятати, то це й буде вже ваш твенг, forever. Зараз я хочу, щоб ми спробували з вами зробити вправу прямо під музичку, да, будемо проспівувати таким звучанням, а, певні ноти. Але перед цим ще обов'язково про технічну особливість взагалі цього твенгу.
3989	9NfgRd-fxw4	00:07:21	Оля	Значить, тут дуже важливо. Дивіться: не старатися співати вправу на повній гучності. Тобто тут середня гучність, достатньо такий, стриманий, звук. А, ви чуєте, наче я роблю це дуже голосно саме через те, що в моєму звучанні дуже багато дзвінких частот, да, і вони роблять таку картинку, дуже яскраво. Насправді, я, не напрягаючись, роблю, тобто я не даю сили сюди. Обов'язково, значить, ми не даємо повітря спеціально, тому що твенг, він: ...
3991	9NfgRd-fxw4	00:07:50	Оля	... "А, I know, I know". Да, там нема: "Ха, ай ноу, ай ноу". Такого там немає. І якщо буде повітря, в принципі, цей ефект не вийде тоді.
3992	9NfgRd-fxw4	00:07:50	Оля	Далі, що допомагає ще. Трошечки робити голос дитячим, чому? Тому що тоді наша гортань підніметься, і, знову ж таки, буде легше, е, технічно зробити твенг.
3993	9NfgRd-fxw4	00:07:50	Оля	Ну що, здається, я нічого не забула. Давайте вже ж нарешті спробуємо.
3994	9NfgRd-fxw4	00:07:50	Оля	А, потрібно вам повторювати за мною. Візьмемо звук: "ай-ай-ай". От бачте, я кажу: "Ай-яй-яй", а треба: ...
3996	9NfgRd-fxw4	00:08:20	Оля	..."Ай-яй-яй, ай-яй-яй". Ги. І зараз проспіваємо з вами таку мелодію: "Ай-яй-яй-яй-яй, Ай-яй-яй-яй-яй, Ай-яй-яй-яй-яй...". Да, тримайте це, неприроднє таке, відчуття: "Ай-яй-яй-яй-яй, Ай-яй-яй-яй-яй". 
3998	9NfgRd-fxw4	00:08:49	Оля	Тепер кашка, ням-ням-ням, дуже смачна: "ням-ням-ням-ням-ням", дитячий голос, ням-ням-ням-ням ням, ням-ням-ням-ням-ням, на посмішці, мням-мням-мням-мням-мням. Зупинились. Тут важливо не перестаратися, ви не маєте відчувати ніякого затиснення ваших голосових зв'язок чи затиснення в горлі, прямо такого неприємного, наче щось там у нас дряпає. Якщо ви зробили, и, вправу і...
4000	9NfgRd-fxw4	00:09:18	Оля	... відчули ось це, тоді стараться трошки, и, тихіше співати, тобто, стримуйте оцей тиск, да. Трошки легше.
4001	9NfgRd-fxw4	00:09:18	Оля	Тепер, ви могли помітити, що, а, голос звучить якось негарно, типу, навіщо ми це робимо, якщо воно, прям, противно. Аг, дивіться, в піснях ми будемо додавати оцей ефект дуже дозовано, дуже трохи. Тобто ми навчимося регулювати,...
4003	9NfgRd-fxw4	00:09:44	Оля	... е, рівень цього дзвіну... Дзвіну? Ми навчимося регулювати рівень цієї дзвінкості. Тобто, будемо, знаєте, як фарбу якусь певну додавати. Що я маю на увазі? Тобто я можу взяти ноту ось так: "А, а". Дала трошки, да? А можу: "А-а". Так я не співаю, да, зрозуміло? А можу: "А-а", взагалі майже нічого не дзвенить.
4005	9NfgRd-fxw4	00:10:11	Оля	 Ось, е, це все ми можемо контролювати. Тобто з такої ноти можна перейти в таку: "А-а-а-а-а-а-а", да? Ось така м'язова робота всередині.
4006	9NfgRd-fxw4	00:10:11	Оля	Тепер ви можете сказати, шо, ну, заспівати "ай-яй-яй", "нє-нє-нє", це, якось, зрозуміло, але як же це можна використати саме в пісні? 
4008	9NfgRd-fxw4	00:10:36	Оля	А дуже просто. Ми зараз з вами спеціально для цього візьмемо фразу відомої пісні, ну, хай буде Ріанна "Yellow diamonds in the light". І спробуємо її, да, заспівати от саме використовуючи оцей дзвін, спочатку гіперболізуємо, тобто максимально дзвінко, а потім спробуємо дати його, наприклад, fifty-fifty, да, дозовано. Давайте спочатку скажемо: "Yellow diamonds in the light". Дзвінко, як американці: "Yellow diamonds in the light". І тепер спробуємо: 
4010	9NfgRd-fxw4	00:11:06	Оля	"Yellow diamonds in the light". Ще раз: "Yellow diamonds in the light". Давайте спробуємо прям максимально дзвінко: "е-е, yellow, yellow diamonds in the light". Тепер трошки менше: "Yellow diamonds in the light, ...
4012	9NfgRd-fxw4	00:11:33	Оля	...Yellow diamonds in the light". Тепер спробуємо ще менше: "Yellow diamonds in the light", вже ближче шось до української мови, "Yellow diamonds in the light". І тепер взагалі, прикрито, повітряно: "Yellow diamonds in the light". 
4014	9NfgRd-fxw4	00:12:02	Оля	Звісно співати англійською легко, якщо ми хочемо саме такий ефект, саме твенг знайти в голосі. А давайте спробуємо одну фразочку заспівати саме українською. Тому що це важче, бо ми звикли говорити, ну, так як я вже казала, більш прикрито. Давайте візьмемо фразу Вакарчука "Я не здамся без бою" і спробуємо заспівати дзвінко. Скажемо, для початку, от саме з... додаючи дзвінкість, да. 
4016	9NfgRd-fxw4	00:12:28	Оля	"Я не здамся без бою, О, май гад, Я не здамся". Да? Однаково: "О, май гад, я не здамся без бою, ай ноу, я не здамся". І спробуємо заспівати: "Я не здамся без бою, Я не здамся без бою, Я не здамся без бою". І ще раз: 
4018	9NfgRd-fxw4	00:12:57	Оля	"Я не здамся без бою". І останній: "Я не здамся без бою". При цьому я співала, як я вже сказала, на середній гучності, да? Це не був якийсь, там, а, звук на максималках, але, при цьому, мій звук був достатньо яскравий, насичений, збагачений обертонами. Тобто різними такими фарбами...
4020	9NfgRd-fxw4	00:13:24	Оля	... у тембрі.
4021	9NfgRd-fxw4	00:13:24	Оля	Ну що, тепер ви знаєте трохи більше про вокальний прийом Твенг. І коли в наступних відео я буду про нього згадувати, ви вже будете розуміти, про що, власне, йде мова.
4022	9NfgRd-fxw4	00:13:24	Оля	Я дуже надіюся, що у вас вийшло відчути якісь зміни у власному звучанні. Поділіться, будь ласка, в коментарях, що все у вас вийшло, можливо, щось було складно чи не зрозуміло. 
4024	9NfgRd-fxw4	00:13:46	Оля	А також пишіть, якщо виникають якісь певні додаткові питання, я з радістю на них відповім. Взагалі, намагалася максимально простими словами пояснити, в чому суть цього прийому. Але, звісно, для того, щоби ним оволодіти, потрібно постійно-постійно практикувати, да, робити цей звук, звикати до нього. Ну, власне, м'язи, вони мають звикнути, і потім вони вже працюють на вас.
4025	9NfgRd-fxw4	00:13:46	Оля	Ось таке було відео про Твенг. Якщо воно вам сподобалося, став свою вподобайку...
4027	9NfgRd-fxw4	00:14:15	Оля	... і підписуйся на канал. До зустрічі в нових відео. 
4042	Bnc2_BkX-xM	00:00:00	Спікер	Оперативний розігрів голосу всього за 10 хвилин. Усім привіт. Вітаю вас на каналі «Оля Провойс».Один, два, три, п’ять, чотири, дев’ять, десять. Сьогоднішнє відео буде присвячено розігріву голосу.Я покажу, як можна оперативно підготувати себе до співу або ж до довгої промови. І що важливо, вам не потрібен жоден інструмент і намагання потрапити в ноти. Тому що я буду давати максимально прості вправи, ...
4045	Bnc2_BkX-xM	00:00:26	Спікер	... але дуже і дуже корисні. Все, що вам потрібно, це повторювати за мною різні звуки, і ви відчуєте, наскільки ваш голосовий апарат запрацює інакше.Тож, якщо у вас настрій поспівати «Океан Ельзи» або Мадонну, вам необхідно, звісно, підготувати себе до цього. Це нам настільки ж необхідно, як спортсмену, який готується до марафону і перед стартом добряче розігріває свої м'язи. Також, якщо в своїй роботі ви дуже і дуже багато говорите, швидко втомлюютеся, ...
4048	Bnc2_BkX-xM	00:00:56	Спікер	... то ці вправи вам будуть на користь.
4049	Bnc2_BkX-xM	00:00:56	Спікер	Перша вправа. Уявіть, що ви тільки-тільки прокинулися, ваш голос максимально розслаблений, і треба зробити такий звук:«а», наче, щось скрипить. Тут немає певної висоти тону, максимально розслаблене, так.
4052	Bnc2_BkX-xM	00:01:18	Спікер	«А». Якщо, наприклад, важко, можна спробувати на «м». «М», такий легкий-легкий стогін. В цей момент ваші голосові зв'язки, вони ще не змикаються, а леше просто, наче, труться і пробуджуються.Всі зайві засилля прибираємо, максимально розслабляємось.
4055	Bnc2_BkX-xM	00:01:41	Спікер	Тут важливо, е, не перетиснути, не перестаратися і не зробити такий звук: «а», «а». Це трошки не той. Нам потрібно на релаксі: «а», «а», «а». Якщо ви все правильно робите, ви нічого навіть не відчуваєте. 
4058	Bnc2_BkX-xM	00:02:00	Спікер	Дуже й дуже легко має бути.
4059	Bnc2_BkX-xM	00:02:00	Спікер	Наступна вправа, ми зробимо слайд.Що таке слайд - ми наче розтягнемо голос нагору і повернемося вниз на такому, носовому, звуці. Значить, це не звук «а», не звук «м», а щось таке: «а», «а», середнє. Але він обов'язково має піти в ніс:  «а», «а», «а». Бачите, чути, що він іде саме сюди?
4062	Bnc2_BkX-xM	00:02:26	Спікер	І нам потрібно з вами не голосно зробити такий слайд: «а-а-а», «а-а-а». Пробуємо: «а-а-а». Теж відчуття дуже і дуже комфортні. Також можна сюди додати трошки сльози і зі сльозами протягнути цей звук ...
4065	Bnc2_BkX-xM	00:02:53	Спікер	...ще раз: «а-а-а». Навіть тембрально чути, як міняється мій голос. Не обов'язково дуже і дуже високо заходити, хоча би трохи голос підняли, опустили, підняли, опустили. Навіщо це нам? В цей момент наші голосові зв'язки, вони витягуються і ідуть назад, витягуються і назад. Коли ми говоримо, ми використовуємо дуже і дуже малий відсоток,...
4068	Bnc2_BkX-xM	00:03:18	Спікер	... взагалі, можливостей, технічних можливостей наших голосових зв'язок. Тобто вони такі, товстенькі, маленькі, і ми собі на низьких нотах, там, де нам зручно, спілкуємось. Коли ми співаємо або робимо «а» - високий якийсь звук, вони як струночка натягуються і стають такі тоненькі і таким чином, наш тон змінюється. Тому треба, щоб наші голосові зв'язки звикли робити це дуже швидко і скоординовано.
4071	Bnc2_BkX-xM	00:03:43	Спікер	Далі будемо з вами говорити звук «г, г, г, г, г», і наче, трошки так, відривати кожний. Він такий, гостренькі, «г, г, г, г, г». Ще пробуємо: «г, г, г, г, г, г, г, г, г, г, г». В якийсь момент він може стати схожим на звук «к». Це нормально. А, тепер уявімо, що ми цей звук «г, г, г» ведемо по сходах знизу вверх:...
4074	Bnc2_BkX-xM	00:04:05	Спікер	... «г, г, г, г, г, г, г, г, г». Ще раз: «г, г, г, г, г, г, г, г, г, г». Тут важливо не йти нагору отаким чином: «г, г, г, г, г, г, г, г», не давити нічого. Легкий звук. Не гучний, дуже розслаблений, спокійний. «г, г, г, г, г, г, г, г, г, г, г». Добре, є. Ще дуже і дуже класно розігріває наш голос отака вправа - ...
4077	Bnc2_BkX-xM	00:04:33	Спікер	...це дещо дивний, можливо, звук для дорослих, тому що дорослі люди його ніколи, в принципі, не роблять, але дітьми ми робимо всі оцей звук: «Тбр». 
4080	Bnc2_BkX-xM	00:04:47	Спікер	А, наче, імітуємо звук мотору машини чи мотоцикла: «Тбр». Теж, ця вправа має досить, так, комфортно відчуватися. А, спробуйте, тому що, взагалі, для вокалу це, прям, вправа номер один. «Тбр». Якщо ви знайшли, вам легко, ви втримуєте цю трєль, вона зветься «трєль губами», або «liprol», спробуємо теж її розтягнути нагору і вниз: ...
4083	Bnc2_BkX-xM	00:05:13	Спікер	... «Тбр». Якщо розсипається звук, можна пальцями підтримати губи, трошки звівши їх в центр: «Тбр», вверх-вниз: «Тбр». Слідкуйте, щоб тут було все розслаблено, не затискайте ваше горло, не допомагайте собі саме горлом. «Тбр». Тут активні саме губи. «Тбр», ...
