5	6u9cNKUM2qs	00:01:12	ВС	Добрий вечір.
8	6u9cNKUM2qs	00:01:15	ПА	Шалом.
11	6u9cNKUM2qs	00:01:18	ОН	Шалом всім. Можна навіть сказати, що вже шабаш «шалом». Будемо чекати пана Тараса, тому що, тіпа, він, швидше за все, забув, бо написав: «Це що, через 25 хв?» Хоча ми домовлялися. Але, в принципі, зараз, можна сказати про те, що ми сьогодні задонатили.
13	6u9cNKUM2qs	00:01:40	ОН	Те, що нарешті прийшло з Ютуба, там, як завжди, 10 000 податків, але то… таке. Ми там віддали фонду Притули на Байрактари, бо треба. Віддали фонду «Повернись живим» 46 666 грн, бо 66-й епізод.
15	6u9cNKUM2qs	00:02:00	ОН	І ще ми 30 000 віддали «Паляниці» на тачку. Зара почекаєм трошки пана Тараса. Можливо, пошукаєм питання одразу пану «Аноніму», поки він тут. Може, щось для нього знайдем. Короче, той во, не переключайтесь.
18	6u9cNKUM2qs	00:02:25	ВС	Тут є просто універсальне питання насправді. От, я думаю, його можна задавати будь-кому. Ви можете просто підходити до людей, задавати це питання на вулиці. Чи не здається вам, що острів Зміїний дуже схожий на Крим в мініатюрі?
21	6u9cNKUM2qs	00:02:43	ПА	Цікаве питання.
24	6u9cNKUM2qs	00:02:47	ВС	Да, мені теж дуже сподобалося.
27	6u9cNKUM2qs	00:02:47	ОН	Дякую за лаконічну відповідь. Від тебе завжди чекаємо саме такі відповіді.
30	6u9cNKUM2qs	00:02:55	ПА	Да? Мені здалося інакше.
33	6u9cNKUM2qs	00:02:59	ОН	Нє, ну, насправді інакше, але, тіпа, ти завжди відповідаєш так. Тому ми вже звикли.
36	6u9cNKUM2qs	00:03:04	ПА	Я просто забуваю зазвичай, шо я хочу сказати в продовження відповіді.
39	6u9cNKUM2qs	00:03:15	Т	Привіт. Раз, два, три…
42	6u9cNKUM2qs	00:03:19	ОН	О, привіт. Чуєш?...
45	6u9cNKUM2qs	00:03:19	ПА	Доброго вечора.
48	6u9cNKUM2qs	00:03:19	Т	Доброго дня.
51	6u9cNKUM2qs	00:03:20	ОН	Пан Тарас, а, може… Да, доброго дня для тебе.
54	6u9cNKUM2qs	00:03:23	ПА	Кому шо…
57	6u9cNKUM2qs	00:03:24	ОН	А тобі, може, зручніше буде без гарнітури? Чи тобі не зручно буде?
60	6u9cNKUM2qs	00:03:29	Т	Я на вулиці. Йду з точки А в точку Б. Тому, тіпа, або так, або ніяк. Вибачайте
63	6u9cNKUM2qs	00:03:35	ОН	Ясно. Ок, значить, будем так
66	6u9cNKUM2qs	00:03:38	Т	А шо, мене погано чути?
69	6u9cNKUM2qs	00:03:41	ОН	Та просто, тіпа, ну, дуже багато скаржились минулого разу, і цього разу так само, тіпа. Багато шуму, але, думаю, якщо ти знімеш гарнітуру, воно, типу, ролі не зіграє.
72	6u9cNKUM2qs	00:03:50	Т	Ну, я тоді буду на гучному. І тоді буде ще гірше, бо так я в навушниках
75	6u9cNKUM2qs	00:03:54	ОН	Ну, я теж так думаю. 
78	6u9cNKUM2qs	00:03:57	Т	Як ваші справи?
81	6u9cNKUM2qs	00:03:58	ОН	А, розповідай, як… Нє, давай ти. Бо ти там. Розповідай, що в тебе там цікавого? Ми зараз будемо тут збирати питання. Ну, точніше, вони вже зібрані. Просто треба їх якось той во..
84	6u9cNKUM2qs	00:04:08	Т	Ну, в мене, насправді, не дуже багато часу, бо в мене зараз має ще бути включення. Ще запис цього інтерв’ю. Я так доєднався на 15 хвилинок. В нас все добре.
87	6u9cNKUM2qs	00:04:20	ОН	Ого!
90	6u9cNKUM2qs	00:04:22	Т	Да. Ну, тож є пан Анонім, я бачу. Десь, може, ще народ підтягнеться
93	6u9cNKUM2qs	00:04:31	ОН	Ладно, давай почнемо. В мене є класне питання. Я його відкладав.
96	6u9cNKUM2qs	00:04:36	Т	Давай.
99	6u9cNKUM2qs	00:04:38	ОН	Зара я його знайду, шоб процитувати дуже точно. Ми зараз відразу попередньо вибачимось, тому що це, тіпа, наша суб’єктивна точка зору, що ці питання мають бути саме в цій поплаві. Тому прошу вас, щоб ви там не цей во.
101	6u9cNKUM2qs	00:04:55	ОН	Ну, тіпа, не думали, шо ви погано питання задаєте, чи ще шось. Просто нам здалося, шо ці питання мають бути десь у цьому от відділі. Короче, було питання наступне, тіпа,… Боже, як її звуть, оцю подругу? Зараз, секунду, треба, щоб не, цей во… Не втратити контекст.
102	6u9cNKUM2qs	00:04:55	ОН	О, я згадав, короче. 
105	6u9cNKUM2qs	00:05:23	ВС	Наконєц-то
108	6u9cNKUM2qs	00:05:24	ОН	Чи генеральний штаб розглядав вигрести Кабаєву і обміняти її на захисників Маріуполя?
111	6u9cNKUM2qs	00:05:32	Т	Ні, не розглядав
114	6u9cNKUM2qs	00:05:35	ОН	А чому?
117	6u9cNKUM2qs	00:05:38	Т	Це серйозне питання?
120	6u9cNKUM2qs	00:05:40	ОН	А, ну, так, це ж серйозно нам задають такі питання.
123	6u9cNKUM2qs	00:05:44	Т	А, ну, я думаю, що генеральний штаб міг планувати в окремому супер-секретному відділі стратегічних операцій викрадення когось найближчого коло Путіна, з його бункера, для того щоб потім його обміняти на когось. Але я ніколи не чув, що в цьому списку могла буть вказана вами особа.
126	6u9cNKUM2qs	00:06:09	ВС	Викрадення дітей з бункеру?
129	6u9cNKUM2qs	00:06:12	Т	Е, ні, ні, ні. З дітьми це не викрадення. Це повернення їх з тяжкої неволі і рабства, сексуального рабства, навіть так скажімо.
132	6u9cNKUM2qs	00:06:22	ПА	Це Кіднепінг, тільки навпаки.
135	6u9cNKUM2qs	00:06:30	ВС	А…
138	6u9cNKUM2qs	00:06:30	ОН	Пан Валерій, давай по-черзі.
141	6u9cNKUM2qs	00:06:32	ВС	Да, давай. А, тут блок питань. А, суть така: чи можна роздовбаним до 155-міліметрового калібру 152-м калібром стріляти %%% 150-міліметровими…, 155-міліметровими снарядами, вибачте мені %%%?
144	6u9cNKUM2qs	00:06:54	Т	Ну, дивіться, один раз можна спробувать, один раз можна спробувать…
147	6u9cNKUM2qs	00:07:02	ОН	Це дуже лаконічно, але дякую. Е, ще давай таке, дуже теоретичне питання. Якби українці мали на руках стільки зброї, як американці, то як би був перебіг цієї війни, якшо ти можеш, и…
150	6u9cNKUM2qs	00:07:17	Т	Її б не було.
153	6u9cNKUM2qs	00:07:19	ОН	Думаєш?
156	6u9cNKUM2qs	00:07:20	Т	Нє, ну якби ми хоча би три роки нормально працювали на підготовку до цієї війни, її б не було. Якби ми хоча би рік хоча би працювали на підготовку до цієї війни, її б не було. Тому це питання не тому, мабуть. Всьої американської зброї, чи ще чогось. Навіть той бюджет, який ми мали, ми активно не використовували, і як наслідок маємо те, що маємо.
159	6u9cNKUM2qs	00:07:47	ВС	Чи можна розбити ракету з автомату?
162	6u9cNKUM2qs	00:07:50	Т	Ракету з автомату? Щас я подумаю. Та нє. Ну, типу, яку ракету?
165	6u9cNKUM2qs	00:08:02	ВС	Тут задано просто ракету, а далі в мене було про, я не пам’ятаю, шо саме, але %%% скоректується
168	6u9cNKUM2qs	00:08:08	Т	Дивіться, якщо по вам %%% летить ракета, а ви берете автомат со ствол, і так по ній прикладом, %%% по летючій ракеті, знаєте, як ото %%%? 
169	6u9cNKUM2qs	00:08:08	Т	Як близько
170	6u9cNKUM2qs	00:08:08	Т	. То я не думаю, що можна збить ракету автоматом.
173	6u9cNKUM2qs	00:08:19	ОН	Я думаю, я думаю, я думаю, шо це, тіпа, вважається, поняв, летить от крилата ракета, ти її бачиш і починаєш стріляти з неї автоматом.
176	6u9cNKUM2qs	00:08:32	Т	Нє
179	6u9cNKUM2qs	00:08:37	ОН	А, ок, давай наступний
182	6u9cNKUM2qs	00:08:38	ВС	То ти 
183	6u9cNKUM2qs	00:08:38	ВС	знов
184	6u9cNKUM2qs	00:08:38	ВС	 всіх зам’ютив, да?
187	6u9cNKUM2qs	00:08:40	ОН	Да, та це я, да, випадково.
190	6u9cNKUM2qs	00:08:42	ВС	Зараз, просто тут і, крім автомату, чи можна збити крилату ракету звичайною мисливською рушницею, і, наприклад, дробом до 
191	6u9cNKUM2qs	00:08:42	ВС	качки
192	6u9cNKUM2qs	00:08:42	ВС	? Якщо так, то чи єсь якісь підтверджені випадки?
195	6u9cNKUM2qs	00:08:54	Т	Ще раз, підтверджені випадки чого?
198	6u9cNKUM2qs	00:08:56	ВС	Збиття крилатої ракети з мисливської рушниці з дробом на качку
201	6u9cNKUM2qs	00:09:01	Т	А, ну, хіба з картєчі. Я думаю, десь %%% тер… тер… тероборона могла б подавати таку інформацію про готовність збивати і навіть підтверджені результати випробовувань
204	6u9cNKUM2qs	00:09:14	ОН	Е, дивись, є ще таке, ту… теж дуже класне, насправді теоретичне, питання. Чи є можливість відправити до Росії нашого снайпера або місцевого снайпера, який там в Росії, шоб застрелити Путіна на якомусь публічному заході?
207	6u9cNKUM2qs	00:09:31	Т	Так кожного тижня відправляємо, от, все, ждем тепер результату. Я думаю, хороша історія, щоб ініціювати збір коштів на подібний проект.
210	6u9cNKUM2qs	00:09:43	ВС	Угу. От… А, тут, насправді, питання непогане, але мені подобається форма: «Чому хамери не постачаються тисячами?».
213	6u9cNKUM2qs	00:09:52	Т	Постачаються
216	6u9cNKUM2qs	00:09:53	ВС	Ага. Ну, це, це, це в середньому…
219	6u9cNKUM2qs	00:09:55	Т	Ну, точніше, ні, але да. 200 зараз і 1000, здається, до кінця року. Але все одно, ну, тобто ми тут на кожній зустрічі,… хамери – це одна з тої техніки, яку ми, там, кожного разу повторюємо.
222	6u9cNKUM2qs	00:10:12	ОН	Ще таке гіпотетичне питання: «Чим нам Ф16 краще за А10?».
225	6u9cNKUM2qs	00:10:19	Т	А, ого, даже шось нормальне. Тим, що нам потрібен багатоцільовий літак-винищувач, який може наносити удари по всіх цілях. А «А10» – вузькоспеціалізована машина. Хоч і хороша, але вузькоспеціалізована. І ми не можем собі дозволити таку розкіш, як мати багато різних літаків. Ну, тобто, це можливий варіант, але він дуже поганий для нас.
228	6u9cNKUM2qs	00:10:43	ВС	От, насправді, просто, там спочатку: «Чим Ф16 краще за А10?», а піс…, одразу після того: «Що відомо про моряків Москви?». Ну, це теж старе питання.
231	6u9cNKUM2qs	00:10:54	Т	Вони, певно, десь потонули.
233	6u9cNKUM2qs	00:10:54	ВС	От…
235	6u9cNKUM2qs	00:10:54	ОН	Ще є, короче, класне питання. Чи варто і чи є сенс випадково, власне, в лапках, знищити газопровід, який іде через нас до країни Європейського Союзу?
237	6u9cNKUM2qs	00:10:54	Т	Я не певен, що це позитивно сприйметься в світі і це те, чим ми маєм займатися.
240	6u9cNKUM2qs	00:11:22	ВС	Чи може Росія непомітно перекинути в Чорне море підводні човни через Босфор?
243	6u9cNKUM2qs	00:11:33	ПА	Непомітно для кого – для турків, які контролюють Босфор і Дарданелли?
245	6u9cNKUM2qs	00:11:33	ОН	Я думаю, шо, тіпа, для всіх, крім турків і нас.
248	6u9cNKUM2qs	00:11:45	ПА	М, ні. Бо, окрім візуального контролю, є така історія, як підводні бурії, які контролюють підводний простір, скажімо так.
251	6u9cNKUM2qs	00:11:59	Т	Дивіться, в цьому немає потреби, бо на Чорному морі їх є достатньо. І Чорне море – це така велика калюжа, де їм особливо нема, що робить, враховуючи, що в України немає плоту, який їм треба топить. А наносить удари калібрами можна і не з підводних човнів, а з будь-якої, там, сухопутної пускової устаноки. Тому це, ну, глибоко теоретично можливо, але потреби в цьому немає.
254	6u9cNKUM2qs	00:12:27	ОН	А… дивись, от нам якраз, здається, вчора, а, може, позавчора, була інфа, шо нам передадуть оцей від Бостон-Дайнемікс, оцього робота. І тут у нас є якраз пов’язане питання: «Що ти думаєш з приводу застосування цих роботів?».
257	6u9cNKUM2qs	00:12:44	Т	И, нічо не думаю. Всі такі суперскладні технології потребують реальної обкатки, тільки тоді, можливо, буде з них якийсь толк. Як показує кожна велика війна, нормальна, працюють тільки такі перевірені, прості, рішення. 
259	6u9cNKUM2qs	00:13:03	Т	Все, шо дуже сложне, заумне, зазвичай не працює або потребує величезних трудозатрат і дає, там, невеликий вихлоп назовні.
262	6u9cNKUM2qs	00:13:16	ВС	Угу. Далі питання, давайте, зай…, зараз буде з… трохи зоологічна поплава. От. По-перше, чи можна натренувати сокола-сапсана для боротьби з ворожими дронами?
265	6u9cNKUM2qs	00:13:29	Т	Ого, ого. Поняття не маю. Мені шкода птахів, тому я не вписуюся в такі історії.
268	6u9cNKUM2qs	00:13:40	ВС	А друге ще краще: «Як ви ставитеся до ідеї – скидувати бджоли-сім’ї з безпілотників на позиції противника? Вони легкі – 1 кг - 10 000 бджіл і зроблять неможливими перебування противника на позиції приблизно на тиждень.
271	6u9cNKUM2qs	00:13:54	Т	Е, наш аналітичний відділ колись готував, е, аналітичну записку для збройних сил і українського – Укроборонпрому – про те, що ми мали б поставити бджіл, як одним з елементів стратегічних неядерних сил стримування, е, на рівні кожної роти безакомобільни десантно-штурмових військ, морської піхоти…
273	6u9cNKUM2qs	00:14:17	Т	…І спеціально розроблені маленькі вулики для ССО, в яких мікросім’ї, але суперпідготовлені і агресивні - для того, шоб закидувати їх в глибокий тил, е, окупаційним військоми
276	6u9cNKUM2qs	00:14:32	ПА	Маю додати, шо там ще було про, е, бж… бджіл-спецпризначенців… А…
279	6u9cNKUM2qs	00:14:38	Т	Так, і про пацюків-всюдиходів
282	6u9cNKUM2qs	00:14:40	ПА	Тактічно
284	6u9cNKUM2qs	00:14:40	Т	Ті, які можуть пересуватися вдень, вночі, зимою, під водою і навіть під землею. При чом я топив найбільше за пацюків.
287	6u9cNKUM2qs	00:14:52	ОН	Є ше таке, теж мені дуже подобається, питання. А,
288	6u9cNKUM2qs	00:14:52	ОН	«Будівельна галузь в Україні стоїть і тому, чи доцільно зробити велике будівництво на кордоні з Білорусією і Росією на зразок лінії Маннергейму, глибиною 30 км?»
291	6u9cNKUM2qs	00:15:09	Т	Ні, тому шо почитайте історію Другої світової війни, і як воно все там спрацювало, в контексті Франції - лінії Мажино. Я якраз про таку читав, читаю, ніяк не доб’ю, Манштейна, і там дуже цікаво це все теж описано. Тому сучасна війна – це повністю про мобільність і про маневр. Тому все, шо стаціонарне, воно, а, може мати сенс, але, и, але ні… І нам більш раціонально вкладатися в якісь, такі, мобільні історії
294	6u9cNKUM2qs	00:15:46	ВС	А, так, маю питання про «Байрактари». Ярославський Деніс, юрист Харківського проектного інституту, заявляє, що Байрактай є розробкою української компанії «Мотор Січ» та харківський машино-будівним, вний завод «ФЕД». Чи це правда?
297	6u9cNKUM2qs	00:16:02	Т	Ще раз. Що завод?
300	6u9cNKUM2qs	00:16:04	ВС	Е, «ФЕД».
303	6u9cNKUM2qs	00:16:05	Т	Так. А шо з ним?
306	6u9cNKUM2qs	00:16:07	ВС	Він розробив «Байрактар», згідно слів цього юриста
309	6u9cNKUM2qs	00:16:10	Т	А… А, ну так, да, канєшно. Ну, як би, весь світовий промисловий, оборонно-промисловий кластер тримається на дідах з українських заводів. Наприклад, от «Боїнг» розробляв свої літаки на «Антонові». А… «Airbus» - в Харкові, на заводі. А… Ну, тобто… Вся наша… наші, американські авіаносці будувалися колись в Миколаєві.
311	6u9cNKUM2qs	00:16:38	Т	Ну, там, ну от, весь світовий, сві…, сві… світовий АПК тримається виключно на українських інженерах, українських підприємствах з унікальною школою, яку просто на Заході не можуть ні відтворити, ні повторити, ні повторити, не навіть вкрасти. І в нас тут до війни тисячі шпигунів намагалися отримати доступ до всіх тих таємних напрацювань, але наша воєнізована охорона їх всіх відловлювала і нікого не допускала. Тому таємниці збережені. Держава може бути спокійною.
314	6u9cNKUM2qs	00:17:08	ОН	Бліна… А я думав, шо, тіпа, це десь в Чорному морі під водою, під Кримом, у нас була таємна база
317	6u9cNKUM2qs	00:17:17	Т	Нє, ну слухайте, ми ж серйозні, серйозні люди про серйозні теми говоримо. Ну які підводні бази? Ну, максимум, це тунелі в Карпатах і аеродром піді Львовом, підземний.
320	6u9cNKUM2qs	00:17:28	ОН	І метро у Львові, до речі, теж.
323	6u9cNKUM2qs	00:17:31	Т	Нє, ви смієтеся, але мені колись на повном сєрьозі напарювали, що у Львівській області є підземний аеродром.
326	6u9cNKUM2qs	00:17:38	ОН	Оце діло. Є ше, короче, таке, теж теоретичне, питання, чи дійсно в Російськой Федерації близько 1,5 тисячі різних бойових літаків? А якшо так, то чому вони всі не літять на нас?
329	6u9cNKUM2qs	00:17:55	Т	А, у них більше тисячі модернізованих або нових літальних апаратів з 2010-го року, це правда. А, 1500 – це може бути всього літальних апаратів. Це не, це не тіки літаки. Ну, то, точніше, не тіки бойові літаки, це ще й вертольоти, це ще й транспортні, і спеціального призначення можуть бути. А, чого не летять всі відразу?
331	6u9cNKUM2qs	00:18:15	Т	Ну, бо поки перший взлетить, е, чи там, останній взлетить, перший вже має сідать, бо треба мать стіки пілотів, треба мати стіки всього і, і, і, і, і. Е, тому воно так не працює. Але чому вони масово не застосовують свою авіацію в якихось, там, товарних кількостях для досягання превосходства в воздухі, переваги в повітрі, мені не зрозуміло.
333	6u9cNKUM2qs	00:18:41	Т	Ну, тому, ну як би, вони не дуже вміють воювати, на щастя, і поки шо паритет в повітрі тримаєтса, як то… Тримається. А ще, якщо ми, нарешті, почнемо якось просувати, просувати тему затриманням американських Ф16, то, я думаю, ситуація, як це, через, там, 1,5-2 роки буде покращуватися…
