1454	LWyJOqikyXU	00:46:08	П	… чи пишіть волонтерам, е, яким ви довіряєте, що є можливість, там, купити ось це за такою-то ціною, е, давайте, там, зберемо гроші і закупимо. Тому шо дуже багато таких дрібних речей теж треба купувати, е, і це теж, я, до речі, хотіла, мабуть, моя основна думка, яку я хотіла сказати, взагалі, на цій поплаві – е, це те, шо немає, е, маленьких і неважливих запитів,…
1456	LWyJOqikyXU	00:46:36	П	… це все одна велика система, і у нас іде дуже багато часу на те, шоб знайти, наприклад, там, якусь класну, е, техніку, яка підходить, під всі параметри. А, але поки ми це робимо, ми відмовляємо людям, які пишуть: «Нам треба, там, три комплекта літньої форми терміново». Е, якшо ви хочете щось робити, у вас є ресурси і ви, особливо, якшо знаходитесь, там, в безпечних регіонах або в Європі, і можете шось закуповувати,…
1458	LWyJOqikyXU	00:47:06	П	… будь ласка, робіть це, пропонуйте конкретну допомогу, е, тим волонтерам, які закривають, не знаю, найбільш симпатичні вам підрозділи. Кому завгодно, пишіть, пропонуйте, тому шо, е, волонтерів в Україні, насправді, багато, але має бути більше. Тому шо запитів дуже багато
1461	LWyJOqikyXU	00:47:30	ВС	Мугу, дякую. Е, Павло, потім пан Лір
1464	LWyJOqikyXU	00:47:34	PB	Да, а, є дуже жиза велика про ТТХ те, шо треба, блін, точно взнати, шо покупаєте те, шо потрібно, і це мій основний заклик. Ну, я, як застереження до слів, яких сказала Ная, шо, якшо ви не знаєте, не купйте. Якшо ви, ну… Якшо потрібно перепитати, краще перепитайте.
1466	LWyJOqikyXU	00:47:52	PB	Е, з Ноунеймами, це взагалі, повна срака і це повний піздєц, ко… коли, типу, намагаються закупити, там, тисячами ці, перепрошую, срані китайські Кети, джгути, і сподіватися, шо вони витягнуть. І так само - з усім обладнанням. Не буває нічого, м, дешевого, е, на…, на війні, ну, бо його потрібно… Ну, нема, нема…
1468	LWyJOqikyXU	00:48:12	PB	Точніше, не буває нічого дорогого. Тобто, звичайно, шо є якась надбавка за бренд, якшо ви хочете, там, ходить тактікульно, на 5-11, то бог вам суддя, канєшно. Але… Ну, я про те, шо, умовно кажучи, потрібно платити, купувати нормальні речі за нормальні бабки. І краще збирати менше, але купувати точно те, шо працює. Тому шо, ну, зі джгутами - це найк… най… найяскравіший приклад, коли люди роблять або якесь гівно, і про це, типу, вже написано багато разів, а потім воно просто розривається на бійці, і не спрацьовує.
1470	LWyJOqikyXU	00:48:39	PB	А, так само, типу, є історія про те, шо ну..., те, шо по змінах відбувається, дійсно, проблема автономності буде зараз більша, і я для себе так розумію, шо, вот, поки є можливість займатись якимись технологічнішими штуками, я буду займатися. Але зараз я, наприклад, переприховую, і частину, е, грошей накопичую на те, шоби починати купувати, наприклад, автономні, а, сонячні станції, е, з сонячними панелями для людей які там будуть тусити, ну, на виїзді до околку, не на спеці.
1472	LWyJOqikyXU	00:49:08	PB	Так само, власне, думати найбільше над такими речима, і їжа, і вода будуть дуже актуальними. Тому, якшо у вас, наприклад, є якісь технологічні рішення по очистці води, теж покидайте мені в ДМ, може, я, там, відбулась якась революція про те, шо я не… не знаю.
1474	LWyJOqikyXU	00:49:24	PB	І, власне, е, такі три поради, шо, якшо не знаєте, краще не купуйте, якшо знаєте, купуйте нормального, а… але менше, а, і думайте над ав… автономністю і мобільністю наших бійців.
1477	LWyJOqikyXU	00:49:40	ВС	Дякую. Пане Лір.
1480	LWyJOqikyXU	00:49:42	ДRCG	Та, також хотів пристегнути до всіх попередніх спікерів стосовно грошей. Взагалі, тут такий, мені здається, виходить, е, синдром раннього слухача поплави. Тобто, е, є невеличкий, на щастя, невеличкий відсоток користувачів цієї соцмережі, які, а, наслухалися свого часу історії Тараса про, е, ТРО, які ходять усі в тактикульному, ходять, там, обвішані, каліматорами, глушниками і всім, чим треба. Точніше, не треба у їхньому випадку, десь у Вінниці.
1482	LWyJOqikyXU	00:50:08	ДRCG	От. І їм тепер здається, що абсолютно будь-який запит, який вартує дешевше, ніж найнижча ціна на ху… хіт онлайн, е, він є, и, барижним, і волонтери наживаються, і взагалі, хіба можна так, а можно за цю суму купити два 
1483	LWyJOqikyXU	00:50:08	ДRCG	їх
1484	LWyJOqikyXU	00:50:08	ДRCG	 менше. Дивіться, ну, стосовно джгутів, е, стосовно кетів, ви сагі, ви самі усе знаєте, ви бачили відос від "Госпітельєрів", про те, як буквально ручка кета відривається, ну, не Кета, а д… дешевого китайського аналогу…
1486	LWyJOqikyXU	00:50:34	ДRCG	Тобто, ну, на цьому економити… Якшо ви... Дивіться, так. Якшо ви купуєте дешеві китайські аналоги турнікетів, то ви буквально вбиваєте наших військових. І це не перебільшення. Тому шо людина, коли отримує поранення, яке потребує затягнування джгутом, е, вона на 100 відсотків гарантує собі, що джгут, який вона має при собі, спрацює. Тобто тут немає оцього вікна можливості, шо я буду робити, якшо мій турнікет не спрацює. Ні, твій турнікет мусить спрацювати.
1488	LWyJOqikyXU	00:51:00	ДRCG	І так само, якшо твого товариша поранили, так само той другий турнікет, який ти з собою носиш для когось, він має спрацювати. І тому, е, навіть такого варіанту, шо 50/50, ні. Ви буквально вбиваєте наше військо, ви допомагаєте русні. Дуже дякую. А, так само, до речі, була ситуація, коли, и, мої друзі придбали сині оці турнікети кетівські і майже, майже відправили їх на передок,…
1490	LWyJOqikyXU	00:51:23	ДRCG	… просто, на шастя, мени скинули фотку, кажуть: "Ось, диви, це ж сертифікат, справжні "Кети", оце все». От. Я встиг їх від… перевідправити на "госпів", не знаю, чи вони встигли доїхати чи ні, але, ну, хоча б будуть тренуватися люди, яким це треба.
1492	LWyJOqikyXU	00:51:36	ДRCG	Другий момент, який я хотів додати… Це стосовно ще того, що потрібно. Нам зараз бракує, страшенно бракує логістики. І я думаю, зараз це стосується не лише нашої невеличкої, та навіть не організації, е, нашої спільноти, а більшості, е, дрібних волонтерів України. А саме, що ти можеш знайти конкретно той вогнегасник, який тобі дали запит в ударній групі. Але цей вогнегасник буде десь у Нідерландах.
1494	LWyJOqikyXU	00:52:03	ДRCG	А ше гірше -  в Гренландії, а ше гірше - у Канаді, не дай боже - у Тайвані. І, е, тобі треба якимось чином його переправити. І, е, ти, звісно, будеш покладатися на чесне слово тих людей, з якими працюють інші волонтери. Або, и, просто, и, якихось друзів друзів. Але, зрештою, дуже часто, прям, значно частіше, ніж хотілося б, стається таке, що, е, н… товари застрягають на кордоні, товари, е, просто, е, плюсуються якимись,…
1496	LWyJOqikyXU	00:52:31	ДRCG	и, логістами і насправді не завозяться, і, е, врешті-решт, е, те, що ми мусили завезти ше, там, е, тиждень тому, досі їде з умовної Канади. Тому, а, якщо ви або ваші родичі, надійні, дуже 
1497	LWyJOqikyXU	00:52:31	ДRCG	вживу
1498	LWyJOqikyXU	00:52:31	ДRCG	, або ваші друзі близькі готові допомагати переправкою, отримувати, е, самовивозом, наприклад, у Німеччині, наприклад, у Великій Британії, товари і потім самостійно брати на себе доставку цього, хоча б до кордону,…
1500	LWyJOqikyXU	00:52:59	ДRCG	… там, з Польщою, умовно кажучи, це зараз дуже на часі. Бо, звісно, у більшості волонтерів є свої перевірені контакти. Але для людей, яким треба, там, своєму куму, брату, свату придбати бронік на вчора, це не працює. І так само ми замовляємо, здебільшого, партію під конкретні потреби, під конкретні запити. І тому... А, да, я читаю усі ці ди… десятки повідомлень про те, що мені треба один бронік, мені треба одну каску,…
1502	LWyJOqikyXU	00:53:23	ДRCG	… і, здебільшого, я не відповідаю не тому, шо я якийсь мудак, а тому що я просто фізично не можу вам знайти один бронік чи одну каску. Зараз є Укроборонпром, е, ми зробили там замовлення, перевіримо наскільки вони ок, нібито, прострілювалися, ніби, нормальні, знову ж таки, перевіримо. Також є потреби на кераміку. Якшо ви маєте контакти, и, адекватного виробника керамічних плит, не самопал, шось адекватне, будь ласка. Для тих, хто не в темі, пояснюю, чому от усі так попаяні на кераміці.
1504	LWyJOqikyXU	00:53:51	ДRCG	Кераміка важить вдвічі менше за сталеві плити. Ну, не завжди вдвічі, але плюс-мінус. І, е, це може здаватися, шо «та це ж наші кіборги, наші пацани, вони ж там взагалі всі сталеві, там, Джони Стіни бігають», але насправді… Ну, по-перше, там є не лише пацани, а по-друге, далеко не всім по кайфу носити 15-17 кіло на собі.
1506	LWyJOqikyXU	00:54:11	ДRCG	І це не враховуючи розгрузку, не враховуючи БК, не враховуючи, е, рюкзак і зброю. Тому керамічні плити - це мастхев, і ми намагаємося вигрібати якомога більше. Тому…, та… також, шоб трошки підсумувати із запитів, логістика по Україні, тому також, знову ж таки, дуже часто підрозділи зараз мігрують і, якшо вчора тобі треба було доставити, там, ці 10, е, и, рюкзакив медичних на Лозову, то сьогодні вони десь пед…, під Херсоном.
1508	LWyJOqikyXU	00:54:37	ДRCG	І це ті самі, е, рюкзаки, які вже їдуть, і тобі треба якось це все переспрямувати. Тому, якшо у вас є своє авто, і ви готові волонтерити, будь ласка, пишіть про це відкрито у Twitterі, я вам гарантую, що ви за добу знайдете собі з десяток замовлень, і люди будуть вам страшенно вдячні. Ну, і те саме стосується, е, замовлень із-за кордону. Тому що тягнути треба багато чого, і багато таких логістів просто не буде забагато.
1511	LWyJOqikyXU	00:55:03	ВС	Дякую дуже. Олю!
1514	LWyJOqikyXU	00:55:07	OS	Та, тут, е, трохи говорили про свої болі, і там згадали за турнікети. Я просто хочу додати, що питання не лише в турнікетах. Це вже сто раз проговорювали, що вони якісні - неякісні. А загалом, це те, чого мені особисто не вистачає, коли, е, люди своїм бажанням допомогти починають займатися тим, що… до чого вони абсолютно ніколи не були дотичні і, дуже важливо, починають збирати аптечки.
1516	LWyJOqikyXU	00:55:37	OS	Дуже багато аптечок пройшло крі… через мої руки, які нам віддавали, шоб передати бійцям, які перепаковувала, тому що там в них, наприклад, наповнення - це 80% це бинт, е, ножниці, пластир, і це все. Або, там, наприклад, лежить в аптечці для бійця, вобше, там - набір ампул із шприцами, і ше якісь речі, яких там не має бути.
1518	LWyJOqikyXU	00:56:04	OS	І якшо ви, наприклад, займаєтеся аптечками, будьте уважні не лише до турнікєтів, так само, до кровоспинних бандажів.
1520	LWyJOqikyXU	00:56:12	OS	Тому що, е, на днях сталась ситуація, коли мені написали, типу, можу передати вам 200 кровоспинних бандажів, я, така: «Клас», типу, подумала, шо вони будуть по типу ізраїльський бандажів, вони приходять, а там якась така резинка, шо на ній, тіпа, повіситись можна. І я розумію, шо класно, шо воно, там, попало умовно в мої руки, і я знаю, як цим корист…, як воно має бути, але, умовно, є люди, якіх, и,… вони не будуть на цьому…,…
1522	LWyJOqikyXU	00:56:40	OS	… в них не буде, в кому спитати, вони не захочуть спитати, і вони це віддадуть військовим, і ті не знатимуть, шо з тим робити. 
1523	LWyJOqikyXU	00:56:40	OS	То
1524	LWyJOqikyXU	00:56:40	OS	 я десь потім викладу ці фото, цієї резинкою, нею реально тільки віситись. Те ж саме стосується кровоспинних, е, гемос… гемостатиків, точніше, які кладуть в аптечки, закуповують масово Целокс в порошку.
1526	LWyJOqikyXU	00:57:01	OS	Я вас дуже прошу, е, в Україні, е, продов…, відновило своє виробництво «Кровоспас», і до них можна звернутися, і вони, там, під певну кількість певним запитом можуть вам їх видати. Кровоспас – це бинт, пропитаний ге…, пропітанний гемостатиком для зупинки, е, кровотечі. І це супер-класно працює, тому що, м, я вже до них зверталася, і вони нам на…, під певні запити цей «Кровоспас» видавали.
1528	LWyJOqikyXU	00:57:29	OS	І, так само, те, шо стосується турнікетів, в нас є така, як незалежна ініціатива, яка, насправді, ше діє з 14-го року - «Центр тестування турнікетів», і у них можна зайти на сторінку, подивитися й…, про різні турнікети, які в нас роблять різні умільці, які достаю…, доставляють із Туреччини, Польщі, Китаю. І там гарно розписано, якими турнікетами можна користуватись, а які лише викинути в смітник.
1531	LWyJOqikyXU	00:57:59	ВС	Угу. Дякую. От. А, насправді щодо плит, ви можете просто пошукати в Twitteri по слову «Спина», твіти від військових, ви зрозумієте, наскіки важливо… вага плити. Е, Павло, потім пан Херсон
1534	LWyJOqikyXU	00:58:15	PB	Е, швидко вставлюся по медицині – ще, будь ласка, дивіться на строки придатності, тому шо, коли присилають бинти 2007-го року простроченості, це піздєц.
1536	LWyJOqikyXU	00:58:24	PB	Е, будь ласка,… ну да, навіть, блять, бинти мають строк годності, його ж, якогось хєра, туди колись написали, перебирайте ту гуманітарку, яку ви відправляєте з Європи, шоб не, ми не робили це, тому шо потім викидати ящиками дуже прикольні речі, особливо, якщо це такмєд, це дуже не прикольно, тому строки годності…, дивіться їх, будь ласка. Дякую.
1539	LWyJOqikyXU	00:58:45	ВС	М, дякую. Пан Херсон, прошу.
1542	LWyJOqikyXU	00:58:48	КН	Вітаю вас, панове…
1545	LWyJOqikyXU	00:58:50	ВС	Вітаємо.
1548	LWyJOqikyXU	00:58:50	КН	Та я підняв руку, тому шо просто скучна розмова якась, у вас, виходить, все...
1551	LWyJOqikyXU	00:58:54	ON	Ти на діскаче?
1554	LWyJOqikyXU	00:58:56	КН	Ну, майже. Хе-хе. А ти заздриш, да?
1557	LWyJOqikyXU	00:58:58	ON	Хе-хе-хе-хе. Канєшно…
1560	LWyJOqikyXU	00:59:00	КН	Хи-хи-хи. 
1561	LWyJOqikyXU	00:59:00	КН	Панімаю
1562	LWyJOqikyXU	00:59:00	КН	. Ну, е… Ну, ви, короче, для мене всі тут, такі, як, е, е,  по… пан гум…, з гуманітарки казав, тактикульні, так, е, ТРО-шники, так ви для мене тактикульні волонтери, тому шо я зані…, займаюсь гуманітаркою. А ви все про мілітарку та про мін…, мілітарку. Е, взяв слово, от, сказати. Е, насправді, я маю дещо відношення до логістики,…
1564	LWyJOqikyXU	00:59:30	КН	… і, м, більше 90, мені здається, відсотків проблем, котри ви кажете, вони логістичні, е, котрі ви озвучуєте, я маю на увазі. Е, логістични не тільки, и, щодо переміщення предметів у просторі, а і щодо організації, е, переміщення предметів у просторі. От, в мене..., м, е, хотів, хотілося б зараз діалогу. До Аліси звернуся.
1566	LWyJOqikyXU	01:00:00	КН	Аліса, а скажи мені, будь ласка, а чи, м, є уявлення, взагалі, а, м, е, порядку цифр, е, постачання, щоб організувати, там, на базі твоїх, е, компетенцій, е, вироблення, е, сухпаїв?
1569	LWyJOqikyXU	01:00:18	AK	Дивися. Ми розглядали це питання. Тому шо ми стикнулись з тим, шо ми... американскі сухпаї, закупити їх ніде, французькі так само. Е, ми намагались, е, вийти на німецькі сухпаї, які нам відмовились продавати, з Ізраїлєм була та сама історія.
1571	LWyJOqikyXU	01:00:38	AK	Е, і після цих пошуків, так, в нас з'явилась думка, шо наша "Паляниця" може на базі наших потужностей виготовляти хороші, якісні сухпайки, але тут питання в об'ємах. Типу, умовно, типу, потужностей для того, шоб виробляти, е, в день, там, півтори тисячі сухпайків, в нас нема на сьогодні.
1573	LWyJOqikyXU	01:01:03	AK	Воробляти 200 сухпайків в день - так, ми можемо. Е, ми розглядали..., я не знаю, ти, напевно, читаєш мої думки, але ми вже розробляли і дивились ТТХ для пок… пакування. Я розглядала, а, варіації, типу, шо ми можемо в сухпайки вже заготовлене закуповувати, шо ми можемо робити самостійно.
